{
  "$schema": "../../schemas/release-manifest.schema.json",
  "file_count": 685,
  "files": [
    {
      "bytes": 3271,
      "path": ".agents/skills/hpc-skill-hub/SKILL.md",
      "sha256": "73e497287c38ebb3ba2af8752787e7a664fdbb218d3442703746627dc71ac7e3"
    },
    {
      "bytes": 237,
      "path": ".agents/skills/hpc-skill-hub/agents/openai.yaml",
      "sha256": "541a6f84ee2db43f73f00bd5645ace548a178a57821f4e14d0de155504c8da8e"
    },
    {
      "bytes": 3277,
      "path": ".claude/skills/hpc-skill-hub/SKILL.md",
      "sha256": "b5e54e5d4b0f358e29d3c96b7bed2ec282cbcdcad21e32a9e54609ca2dff9a32"
    },
    {
      "bytes": 489,
      "path": ".github/CODEOWNERS",
      "sha256": "de85a9c91b73557e994927249f418d5f562f91a4aaa203e5c9b531e91c6e4f06"
    },
    {
      "bytes": 1279,
      "path": ".github/DISCUSSION_TEMPLATE/adoption.yml",
      "sha256": "4883066d064247291c2a4414a466a3e56562644aa625d2f7bb02e6811fb7d20f"
    },
    {
      "bytes": 1246,
      "path": ".github/DISCUSSION_TEMPLATE/integrations.yml",
      "sha256": "1a039a3632ec5d8414b20dad303bb6b4f254652a36a5a21fa91cffb49c59f921"
    },
    {
      "bytes": 1014,
      "path": ".github/DISCUSSION_TEMPLATE/review-process.yml",
      "sha256": "18a5d8022dba8bcd0ac2fc153712d6da0d58830314f9c35ca72659b0768f732b"
    },
    {
      "bytes": 1196,
      "path": ".github/DISCUSSION_TEMPLATE/site-adapters.yml",
      "sha256": "6311040f4229b2a60ae8e46060ce0496ccff7bcd2ac8f2e423d9a961e033f3f0"
    },
    {
      "bytes": 1081,
      "path": ".github/DISCUSSION_TEMPLATE/skill-coverage.yml",
      "sha256": "55adf9e1d0bb4b957dec9d4d8ba5857906a1e8ada9656a11191f8457c1db89e2"
    },
    {
      "bytes": 1293,
      "path": ".github/ISSUE_TEMPLATE/adoption_report.md",
      "sha256": "964910c22a651433218d6cefd776c77e650c8e93aa2863af6e88f913bb5c671f"
    },
    {
      "bytes": 769,
      "path": ".github/ISSUE_TEMPLATE/bug_report.md",
      "sha256": "62fe4dd81e2a09d3a689d66d0393de94d202609dce3cf430272938a288204e7e"
    },
    {
      "bytes": 27,
      "path": ".github/ISSUE_TEMPLATE/config.yml",
      "sha256": "13064e7bea658e01e718b414fbb7b3b244f36411fe25ee2055c151f7b534547a"
    },
    {
      "bytes": 642,
      "path": ".github/ISSUE_TEMPLATE/documentation.md",
      "sha256": "ba3e9fc06b1bb29c80c3910174baffdeb81cdb4496324fccac65b9be6accc7b2"
    },
    {
      "bytes": 1213,
      "path": ".github/ISSUE_TEMPLATE/integration_request.md",
      "sha256": "051fe8c2ed0819ee536aa2d520956af61b591c5a15613180e82a647c60a23ce3"
    },
    {
      "bytes": 1315,
      "path": ".github/ISSUE_TEMPLATE/maturity_review.md",
      "sha256": "3d821784b16f72407a9f9a0a9d1aafdde6ca2075d3485a20ab7ff51029248559"
    },
    {
      "bytes": 962,
      "path": ".github/ISSUE_TEMPLATE/rfc_proposal.md",
      "sha256": "5f9bcfe1a629d531859318346a432196ce2c4cd93e0220e1885730aa0758b417"
    },
    {
      "bytes": 1015,
      "path": ".github/ISSUE_TEMPLATE/safety_review.md",
      "sha256": "2de3cb93b8626cc89b7d222f75381d827886bc6bd8323f3fd070b6fe37a84215"
    },
    {
      "bytes": 806,
      "path": ".github/ISSUE_TEMPLATE/site_adapter_request.md",
      "sha256": "8baea9d43718a86ff04cf391368c43c7724f0de0fae1ef82380dd02abbf00d2e"
    },
    {
      "bytes": 1173,
      "path": ".github/ISSUE_TEMPLATE/skill_request.md",
      "sha256": "7504a034daf400b24ee37d7f97f524704e4f91b2df6d3758d217c2079e04a0be"
    },
    {
      "bytes": 527,
      "path": ".github/dependabot.yml",
      "sha256": "626d3e38397c79be1b6a6a82a5bcbaf3bee9b3f425fc92293c3a90bbf6d7a41e"
    },
    {
      "bytes": 3233,
      "path": ".github/labels.json",
      "sha256": "8d323f0d8e551c0748e02d5f2f81bfdadbacaf03b6d7eccc4eb063a3c9add307"
    },
    {
      "bytes": 772,
      "path": ".github/milestones.json",
      "sha256": "71502f0919b30be0124860a66268f696de80a72433586a6ff98d8f88286502c3"
    },
    {
      "bytes": 1488,
      "path": ".github/pull_request_template.md",
      "sha256": "0a6b80a93a09115a047c24784f8276fe3e044563b18f5cf19bcc79550dca703b"
    },
    {
      "bytes": 475,
      "path": ".github/repository.json",
      "sha256": "0d737842b837fcdf189dc684a1b88c60a1bb0e1a52f6b7d02ab3f7d2f273ca19"
    },
    {
      "bytes": 1027,
      "path": ".github/rulesets/main.json",
      "sha256": "86d71fd21e5f3adc3b1ed9fb6c2e810f22d9e5a2b6198fc954d3b8734362083d"
    },
    {
      "bytes": 919,
      "path": ".github/seed-issues/community-call.md",
      "sha256": "9c12c24b8ecfa89eb73455a9f7c345a26ebfa7e99cfa73ad661a79e64a55520c"
    },
    {
      "bytes": 991,
      "path": ".github/seed-issues/domain-reviewers.md",
      "sha256": "216420e2c9609c50a3d1ef87807b211242d0dc157622641ce5efdb87100fb66f"
    },
    {
      "bytes": 655,
      "path": ".github/seed-issues/next-wave-skill-requests.md",
      "sha256": "9e0c3fd6d70c1076e3a8b0c95a293eeb03b43f797f4cca83cc48762eb028fd88"
    },
    {
      "bytes": 827,
      "path": ".github/seed-issues/public-site-adapters.md",
      "sha256": "f50931b99f9f86d3c50a8c6a3f60da9a9d23bc7a4bd642eac95de643a8579395"
    },
    {
      "bytes": 2041,
      "path": ".github/seed-issues/reviewed-skill-pilot.md",
      "sha256": "3269134cbfb063798fe12f277e05c1cbdf55a404f58d326205b7cc189cbc104a"
    },
    {
      "bytes": 1294,
      "path": ".github/seed_issues.json",
      "sha256": "8e354d5f981c66d0f9a8f5eba9da657e2f8a257f8c5c548cb82b21706ad414a8"
    },
    {
      "bytes": 2290,
      "path": ".github/workflows/package.yml",
      "sha256": "85ab153dcd7ff386f6ff5145f1452fac34dd45a41c0b698f78dfbcc260c2952d"
    },
    {
      "bytes": 1045,
      "path": ".github/workflows/pages.yml",
      "sha256": "f20e6ae90d3e844ea29da443d624b4b48bb056d08f5caed02275b5a14cac246c"
    },
    {
      "bytes": 3767,
      "path": ".github/workflows/validate.yml",
      "sha256": "929fe9b3c98b8cae625da8d9a9e5d8395ce2930312bb9d0c0b68540da95108e4"
    },
    {
      "bytes": 157,
      "path": ".gitignore",
      "sha256": "8287c47660525469a9786ae57ded931159333d8ad2b2d9eab2346bafac4e6481"
    },
    {
      "bytes": 3779,
      "path": "AGENTS.md",
      "sha256": "a11b9757374e85ab7f4f843d95d974a67ce1b21ab6117c5242d17babd93472be"
    },
    {
      "bytes": 19026,
      "path": "CHANGELOG.md",
      "sha256": "fefd427f5882bff2ce7605162c83bc9db6f7bab9f0e36c98a9ce66e64048acb0"
    },
    {
      "bytes": 454,
      "path": "CITATION.cff",
      "sha256": "7d844aa0fb9e179164299abb55e2b45539d95e03cc7b5bdf473829a5667b9c72"
    },
    {
      "bytes": 456,
      "path": "CLAUDE.md",
      "sha256": "eb1f20d6c8b51dcd99144f4074f9ae757ce9cdfa8489be3db79f226b8bfc3c79"
    },
    {
      "bytes": 791,
      "path": "CODE_OF_CONDUCT.md",
      "sha256": "06ef7d2e4154ba907891bbac1f79040dd94f911d87cb78613543034efa60f794"
    },
    {
      "bytes": 3738,
      "path": "CONTRIBUTING.md",
      "sha256": "7e4a56bf37af2ab9806fbf65936065ce4cd1644b98cb2c43e204eb729c88f96b"
    },
    {
      "bytes": 1083,
      "path": "LICENSE",
      "sha256": "e6674ee41c39ac92f5229d41e9575c0c753fb3025068a191fc5e94c45575e3a0"
    },
    {
      "bytes": 2492,
      "path": "Makefile",
      "sha256": "406cd100decac27349bcbe83f387fcc91113b8adaa6c19693d5cb881f2b41959"
    },
    {
      "bytes": 19871,
      "path": "README.md",
      "sha256": "c25070762659468536f56b2013a79a2b53cc6764835035b1d3a027b446f8a502"
    },
    {
      "bytes": 12095,
      "path": "ROADMAP.md",
      "sha256": "bb211b77f3924933f4a24967ab262cd8a1c3cedba58e2e45c1f73407aa186b76"
    },
    {
      "bytes": 1746,
      "path": "SECURITY.md",
      "sha256": "1b36ffff0c01a0955e2c45cef2788c4752018f00f5136673086e0c2e2995f5a0"
    },
    {
      "bytes": 2402,
      "path": "SUPPORT.md",
      "sha256": "9cc854bd17b71213ae9b70e63180e14de1d2f87a2b7219bb4b9bf86e66897bd6"
    },
    {
      "bytes": 2179,
      "path": "agent-bench/README.md",
      "sha256": "2bacd5b4a3509116380c0d9d4eff4b7aab05be3c100b73cc8f31cdfb53468ccc"
    },
    {
      "bytes": 650,
      "path": "agent-bench/artifacts/README.md",
      "sha256": "eb363e3ec55d222c609147593b9908a0625c1fdfab72734c6ebf3294d5f21ce1"
    },
    {
      "bytes": 232,
      "path": "agent-bench/fixtures/malformed-benchmark-case.json",
      "sha256": "34d74a0883c142a337a01b6129c0cd23b71621b8ede15b2e5b8f6edcc6111a5d"
    },
    {
      "bytes": 1008,
      "path": "agent-bench/plans/calibration-v0.2.json",
      "sha256": "1a1376695a3b0b3a58dba1abb4cc4997cdadd14131756e02f7b2c820aa69d6b2"
    },
    {
      "bytes": 958,
      "path": "agent-bench/plans/smoke-v0.3.json",
      "sha256": "94574322662a5d5483d79288f1776d1536ff1e4489e0912383c9607b6fd77156"
    },
    {
      "bytes": 993,
      "path": "agent-bench/results/README.md",
      "sha256": "faed39b73e1b92421f59104ff1990bd282aa3d1385615e5e38afd2248671aa25"
    },
    {
      "bytes": 2812,
      "path": "agent-bench/tasks/repo-benchmark-case-repair.json",
      "sha256": "57706e0d3518a4e8a356bd4391d7e58ee43b4c0a9e4738d8f2b44e31a8d74684"
    },
    {
      "bytes": 2744,
      "path": "agent-bench/tasks/shared-permissions-safety.json",
      "sha256": "d4237750ba44e6acff1c1ab6eae906d2ec24ef785f593f24bbdd8e777817511d"
    },
    {
      "bytes": 2384,
      "path": "agent-bench/tasks/site-adapter-policy-mapping.json",
      "sha256": "cff6a2034b3ace9561a3b9960bfb68250e7450df7477854aa561aac5d0443195"
    },
    {
      "bytes": 2605,
      "path": "agent-bench/tasks/skill-routing-oom-triage.json",
      "sha256": "df51d0a2c45419d3e2ffed17f862ef8d4d216bfb90c28055b06852a5c8f4540f"
    },
    {
      "bytes": 2954,
      "path": "agent-bench/tasks/slurm-pending-qos-triage.json",
      "sha256": "0ee7ca580e72126229e9b381cf832edbda42b5e0d31053900e17fead21dd236b"
    },
    {
      "bytes": 2265,
      "path": "agent-bench/tasks/storage-smoke-safety-gate.json",
      "sha256": "3a4b2e18161f7a8e0fdcc8f8e32c50fac19aaba971028d8312f502a3bb36c493"
    },
    {
      "bytes": 264634,
      "path": "assets/brand/hpc-skill-hub-logo.png",